<?xml version="1.0" encoding="UTF-8"?>
<app xmlns="http://www.asterdata.com/apps" xmlns:xsi="http://www.w3.org/2001/XMLSchema-instance" xsi:schemaLocation="http://www.asterdata.com/apps com/teradata/aster/app/sdk/app.xsd">
  <name>Table Visualizer</name>
  <version>1.0</version>
  <description>Creates a Table View for database tables</description>
  <dependencies/>
  <developed-by>Teradata Labs</developed-by>
  <developer-id>com.teradata.labs.apps.eran</developer-id>
  <built-with-SDK-version>6.10.r54029</built-with-SDK-version>
  <logic type="SQL">
    <app-class>com.teradata.appcenter.appmgmt.genericapp.GenericApp</app-class>
    <queries>
      <query>-- Query to visualize table
insert into app_center_visualizations values (1,
'{
    "db_table_name":"${db_table_name}",
    "vizType":"table",
    "version":"1.0",
    "title":"Data from ${db_table_name}"
}');</query>
    </queries>
  </logic>
  <output-tables/>
  <input-tables/>
  <parameters>
    <parameter description="Enter the fully qualified name of the database table" label="Database table to view" name="db_table_name" type="Text"/>
  </parameters>
  <constants/>
</app>
